16:19:59.979337 IP iZuf6fmau4f007hf7x4i8jZ.ssh > 180.168.40.98.3042: Flags [P.], seq 2398415137:2398415265, ack 2768159596, win 315, length 128
16:19:59.979548 IP iZuf6fmau4f007hf7x4i8jZ.ssh > 180.168.40.98.3042: Flags [P.], seq 128:1168, ack 1, win 315, length 1040
16:19:59.979586 IP iZuf6fmau4f007hf7x4i8jZ.ssh > 180.168.40.98.3042: Flags [P.], seq 1168:2944, ack 1, win 315, length 1776
16:19:59.979672 IP iZuf6fmau4f007hf7x4i8jZ.ssh > 180.168.40.98.3042: Flags [P.], seq 2944:3072, ack 1, win 315, length 128
16:19:59.979844 IP iZuf6fmau4f007hf7x4i8jZ.ssh > 180.168.40.98.3042: Flags [P.], seq 3072:4112, ack 1, win 315, length 1040
16:19:59.979877 IP iZuf6fmau4f007hf7x4i8jZ.ssh > 180.168.40.98.3042: Flags [P.], seq 4112:5904, ack 1, win 315, length 1792
16:19:59.985639 IP 180.168.40.98.3042 > iZuf6fmau4f007hf7x4i8jZ.ssh: Flags [.], ack 128, win 1026, length 0
16:19:59.986396 IP 180.168.40.98.3042 > iZuf6fmau4f007hf7x4i8jZ.ssh: Flags [.], ack 3072, win 1026, length 0
16:19:59.986405 IP 180.168.40.98.3042 > iZuf6fmau4f007hf7x4i8jZ.ssh: Flags [.], ack 5904, win 1026, length 0
16:19:59.994707 IP iZuf6fmau4f007hf7x4i8jZ.56912 > 100.100.30.25.http: Flags [P.], seq 159052038:159053624, ack 1271820754, win 1452, length 1586: HTTP
16:19:59.999493 IP 100.100.30.25.http > iZuf6fmau4f007hf7x4i8jZ.56912: Flags [.], ack 1586, win 24565, length 0
16:20:01.487526 ARP, Request who-has iZuf6fmau4f007hf7x4i8jZ tell _gateway, length 28
16:20:01.487547 ARP, Reply iZuf6fmau4f007hf7x4i8jZ is-at 00:16:3e:06:b3:2a (oui Unknown), length 28
16:20:02.005018 IP iZuf6fmau4f007hf7x4i8jZ.46630 > 100.100.2.136.domain: 16112+ PTR? 253.63.17.172.in-addr.arpa. (44)
16:20:02.005372 IP 100.100.2.136.domain > iZuf6fmau4f007hf7x4i8jZ.46630: 16112 NXDomain* 0/1/0 (98)
16:20:03.061894 IP iZuf6fmau4f007hf7x4i8jZ.ssh > 180.168.40.98.3042: Flags [P.], seq 5904:6176, ack 1, win 315, length 272
16:20:03.112456 IP 180.168.40.98.3042 > iZuf6fmau4f007hf7x4i8jZ.ssh: Flags [.], ack 6176, win 1025, length 0
16:20:06.322653 IP iZuf6fmau4f007hf7x4i8jZ.38592 > 100.100.109.104.http: Flags [S], seq 3273459688, win 29200, options [mss 1460,sackOK,TS val 808409333 ecr 0,nop,wscale 7], length 0
16:20:06.324257 IP 100.100.109.104.http > iZuf6fmau4f007hf7x4i8jZ.38592: Flags [S.], seq 85706637, ack 3273459689, win 14600, options [mss 1440,nop,nop,sackOK,nop,wscale 7], length 0
16:20:06.324288 IP iZuf6fmau4f007hf7x4i8jZ.38592 > 100.100.109.104.http: Flags [.], ack 1, win 229, length 0
16:20:06.324556 IP iZuf6fmau4f007hf7x4i8jZ.38592 > 100.100.109.104.http: Flags [P.], seq 1:4097, ack 1, win 229, length 4096: HTTP: POST /agent/metrics/putLines HTTP/1.1
16:20:06.324577 IP iZuf6fmau4f007hf7x4i8jZ.38592 > 100.100.109.104.http: Flags [P.], seq 4097:7962, ack 1, win 229, length 3865: HTTP
16:20:06.326081 IP 100.100.109.104.http > iZuf6fmau4f007hf7x4i8jZ.38592: Flags [.], ack 1441, win 137, length 0
16:20:06.326096 IP 100.100.109.104.http > iZuf6fmau4f007hf7x4i8jZ.38592: Flags [.], ack 2881, win 160, length 0
16:20:06.326104 IP 100.100.109.104.http > iZuf6fmau4f007hf7x4i8jZ.38592: Flags [.], ack 4097, win 183, length 0
16:20:06.326108 IP 100.100.109.104.http > iZuf6fmau4f007hf7x4i8jZ.38592: Flags [.], ack 5537, win 206, length 0
16:20:06.326111 IP 100.100.109.104.http > iZuf6fmau4f007hf7x4i8jZ.38592: Flags [.], ack 6977, win 229, length 0
16:20:06.326114 IP 100.100.109.104.http > iZuf6fmau4f007hf7x4i8jZ.38592: Flags [.], ack 7962, win 251, length 0
16:20:06.326812 IP 100.100.109.104.http > iZuf6fmau4f007hf7x4i8jZ.38592: Flags [P.], seq 1:166, ack 7962, win 251, length 165: HTTP: HTTP/1.1 200 OK
16:20:06.326821 IP iZuf6fmau4f007hf7x4i8jZ.38592 > 100.100.109.104.http: Flags [.], ack 166, win 237, length 0
16:20:06.326869 IP 100.100.109.104.http > iZuf6fmau4f007hf7x4i8jZ.38592: Flags [F.], seq 166, ack 7962, win 251, length 0
16:20:06.326883 IP iZuf6fmau4f007hf7x4i8jZ.38592 > 100.100.109.104.http: Flags [F.], seq 7962, ack 167, win 237, length 0
16:20:06.328396 IP 100.100.109.104.http > iZuf6fmau4f007hf7x4i8jZ.38592: Flags [.], ack 7963, win 251, length 0
16:20:06.419286 IP iZuf6fmau4f007hf7x4i8jZ.56912 > 100.100.30.25.http: Flags [P.], seq 1586:2544, ack 1, win 1452, length 958: HTTP
16:20:06.424087 IP 100.100.30.25.http > iZuf6fmau4f007hf7x4i8jZ.56912: Flags [.], ack 2544, win 24569, length 0
16:20:07.124819 IP iZuf6fmau4f007hf7x4i8jZ.46294 > 100.100.2.136.domain: 12900+ PTR? 104.109.100.100.in-addr.arpa. (46)
16:20:07.125041 IP 100.100.2.136.domain > iZuf6fmau4f007hf7x4i8jZ.46294: 12900 NXDomain* 0/1/0 (101)
16:20:09.958758 IP 100.100.30.25.http > iZuf6fmau4f007hf7x4i8jZ.56912: Flags [P.], seq 1:11, ack 2544, win 24576, length 10: HTTP
16:20:09.964014 IP iZuf6fmau4f007hf7x4i8jZ.56912 > 100.100.30.25.http: Flags [P.], seq 2544:2550, ack 11, win 1452, length 6: HTTP
16:20:09.968792 IP 100.100.30.25.http > iZuf6fmau4f007hf7x4i8jZ.56912: Flags [.], ack 2550, win 24576, length 0
16:20:19.750656 IP iZuf6fmau4f007hf7x4i8jZ.56912 > 100.100.30.25.http: Flags [P.], seq 2550:3656, ack 11, win 1452, length 1106: HTTP
16:20:19.755431 IP 100.100.30.25.http > iZuf6fmau4f007hf7x4i8jZ.56912: Flags [.], ack 3656, win 24568, length 0
16:20:21.336610 IP iZuf6fmau4f007hf7x4i8jZ.38594 > 100.100.109.104.http: Flags [S], seq 3133759900, win 29200, options [mss 1460,sackOK,TS val 808424347 ecr 0,nop,wscale 7], length 0
16:20:21.339059 IP 100.100.109.104.http > iZuf6fmau4f007hf7x4i8jZ.38594: Flags [S.], seq 4179790356, ack 3133759901, win 14600, options [mss 1440,nop,nop,sackOK,nop,wscale 7], length 0
16:20:21.339093 IP iZuf6fmau4f007hf7x4i8jZ.38594 > 100.100.109.104.http: Flags [.], ack 1, win 229, length 0
16:20:21.339258 IP iZuf6fmau4f007hf7x4i8jZ.38594 > 100.100.109.104.http: Flags [P.], seq 1:4097, ack 1, win 229, length 4096: HTTP: POST /agent/metrics/putLines HTTP/1.1
16:20:21.339273 IP iZuf6fmau4f007hf7x4i8jZ.38594 > 100.100.109.104.http: Flags [P.], seq 4097:7803, ack 1, win 229, length 3706: HTTP
16:20:21.341717 IP 100.100.109.104.http > iZuf6fmau4f007hf7x4i8jZ.38594: Flags [.], ack 1441, win 137, length 0
16:20:21.341778 IP 100.100.109.104.http > iZuf6fmau4f007hf7x4i8jZ.38594: Flags [.], ack 2881, win 160, length 0
16:20:21.341781 IP 100.100.109.104.http > iZuf6fmau4f007hf7x4i8jZ.38594: Flags [.], ack 4097, win 183, length 0
16:20:21.341852 IP 100.100.109.104.http > iZuf6fmau4f007hf7x4i8jZ.38594: Flags [.], ack 5537, win 206, length 0
16:20:21.341866 IP 100.100.109.104.http > iZuf6fmau4f007hf7x4i8jZ.38594: Flags [.], ack 6977, win 229, length 0
16:20:21.341869 IP 100.100.109.104.http > iZuf6fmau4f007hf7x4i8jZ.38594: Flags [.], ack 7803, win 251, length 0
16:20:21.344275 IP 100.100.109.104.http > iZuf6fmau4f007hf7x4i8jZ.38594: Flags [P.], seq 1:166, ack 7803, win 251, length 165: HTTP: HTTP/1.1 200 OK
16:20:21.344291 IP iZuf6fmau4f007hf7x4i8jZ.38594 > 100.100.109.104.http: Flags [.], ack 166, win 237, length 0
16:20:21.344303 IP 100.100.109.104.http > iZuf6fmau4f007hf7x4i8jZ.38594: Flags [F.], seq 166, ack 7803, win 251, length 0
16:20:21.344424 IP iZuf6fmau4f007hf7x4i8jZ.38594 > 100.100.109.104.http: Flags [F.], seq 7803, ack 167, win 237, length 0
16:20:21.346853 IP 100.100.109.104.http > iZuf6fmau4f007hf7x4i8jZ.38594: Flags [.], ack 7804, win 251, length 0
16:20:31.811438 ARP, Request who-has iZuf6fmau4f007hf7x4i8jZ tell _gateway, length 28
16:20:31.811459 ARP, Reply iZuf6fmau4f007hf7x4i8jZ is-at 00:16:3e:06:b3:2a (oui Unknown), length 28
16:20:36.354742 IP iZuf6fmau4f007hf7x4i8jZ.38137 > 100.100.2.136.domain: 24479+ A? metrichub-cn-shanghai.aliyun.com. (50)
16:20:36.355001 IP 100.100.2.136.domain > iZuf6fmau4f007hf7x4i8jZ.38137: 24479* 1/0/0 A 100.100.109.104 (66)
16:20:36.355386 IP iZuf6fmau4f007hf7x4i8jZ.38596 > 100.100.109.104.http: Flags [S], seq 2414870226, win 29200, options [mss 1460,sackOK,TS val 808439366 ecr 0,nop,wscale 7], length 0
16:20:36.357223 IP 100.100.109.104.http > iZuf6fmau4f007hf7x4i8jZ.38596: Flags [S.], seq 3900546502, ack 2414870227, win 14600, options [mss 1440,nop,nop,sackOK,nop,wscale 7], length 0
16:20:36.357250 IP iZuf6fmau4f007hf7x4i8jZ.38596 > 100.100.109.104.http: Flags [.], ack 1, win 229, length 0
16:20:36.357395 IP iZuf6fmau4f007hf7x4i8jZ.38596 > 100.100.109.104.http: Flags [P.], seq 1:4097, ack 1, win 229, length 4096: HTTP: POST /agent/metrics/putLines HTTP/1.1
16:20:36.357409 IP iZuf6fmau4f007hf7x4i8jZ.38596 > 100.100.109.104.http: Flags [P.], seq 4097:7798, ack 1, win 229, length 3701: HTTP
16:20:36.359227 IP 100.100.109.104.http > iZuf6fmau4f007hf7x4i8jZ.38596: Flags [.], ack 4097, win 137, length 0
16:20:36.359243 IP 100.100.109.104.http > iZuf6fmau4f007hf7x4i8jZ.38596: Flags [.], ack 7798, win 160, length 0
16:20:36.359822 IP 100.100.109.104.http > iZuf6fmau4f007hf7x4i8jZ.38596: Flags [P.], seq 1:166, ack 7798, win 160, length 165: HTTP: HTTP/1.1 200 OK
16:20:36.359834 IP iZuf6fmau4f007hf7x4i8jZ.38596 > 100.100.109.104.http: Flags [.], ack 166, win 237, length 0
16:20:36.359848 IP 100.100.109.104.http > iZuf6fmau4f007hf7x4i8jZ.38596: Flags [F.], seq 166, ack 7798, win 160, length 0
16:20:36.359917 IP iZuf6fmau4f007hf7x4i8jZ.38596 > 100.100.109.104.http: Flags [F.], seq 7798, ack 167, win 237, length 0
16:20:36.361711 IP 100.100.109.104.http > iZuf6fmau4f007hf7x4i8jZ.38596: Flags [.], ack 7799, win 160, length 0
16:20:39.948231 IP iZuf6fmau4f007hf7x4i8jZ.56912 > 100.100.30.25.http: Flags [P.], seq 3656:4790, ack 11, win 1452, length 1134: HTTP
16:20:39.953007 IP 100.100.30.25.http > iZuf6fmau4f007hf7x4i8jZ.56912: Flags [.], ack 4790, win 24568, length 0

